{
  "schemaVersion": "1",
  "executionId": "exec-ra-fixture",
  "workflowId": "wf-local-demo",
  "stageId": "02-requirement-analysis",
  "workspaceRoot": "*",
  "issuedAt": "2026-08-25T00:00:00.000Z",
  "expiresAt": "2099-01-01T00:00:00.000Z",
  "singleUse": true,
  "writeMode": "read_write",
  "allowedTools": ["Read", "Grep", "Glob", "SemanticSearch", "Write", "StrReplace", "AskQuestion"],
  "deniedTools": ["Delete", "Shell", "Task"],
  "allowedPaths": [
    "savyre/stages/02-requirement-analysis/ai-output.md",
    "savyre/stages/02-requirement-analysis/challenge-findings.json"
  ],
  "excludedPaths": [".env", ".env.local", ".env.production", "id_rsa", "id_ed25519", "*.pem", "credentials.json", "secrets.json"],
  "evidenceRequired": true,
  "keyId": "savyre-local-test",
  "signature": "template-only-run-cli-rebinds-workspace-and-resigns"
}
