{
  "schemaVersion": "1",
  "executionId": "exec-im-fixture",
  "workflowId": "wf-local-demo",
  "stageId": "06-implementation",
  "workspaceRoot": "*",
  "issuedAt": "2026-08-25T00:00:00.000Z",
  "expiresAt": "2099-01-01T00:00:00.000Z",
  "singleUse": true,
  "writeMode": "read_write",
  "allowedTools": ["Read", "Grep", "Glob", "SemanticSearch", "Write", "StrReplace", "AskQuestion"],
  "deniedTools": ["Delete", "Shell", "Task"],
  "allowedPaths": ["**"],
  "excludedPaths": [".env", ".env.local", ".env.production", "id_rsa", "id_ed25519", "*.pem", "credentials.json", "secrets.json"],
  "evidenceRequired": true,
  "keyId": "savyre-local-test",
  "signature": "template-only-run-cli-rebinds-workspace-and-resigns"
}
